# The author disclaims copyright to this source code.  In place of
# a legal notice, here is a blessing:
#
#    May you do good and not evil.
#    May you find forgiveness for yourself and forgive others.
#    May you share freely, never taking more than you give.
#
#*******************************************************
#
# This file tests creating and dropping triggers, and interaction thereof
# with the database COMMIT/ROLLBACK logic.
#
# 1. CREATE and DROP TRIGGER tests
# trigger1-1.1: Error if table does not exist
# trigger1-1.2: Error if trigger already exists
# trigger1-1.3: Created triggers are deleted if the transaction is rolled back
# trigger1-1.4: DROP TRIGGER removes trigger
# trigger1-1.5: Dropped triggers are restored if the transaction is rolled back
# trigger1-1.6: Error if dropped trigger doesn't exist
# trigger1-1.7: Dropping the table automatically drops all triggers
# trigger1-1.8: A trigger created on a TEMP table is not inserted into sqlite_master
# trigger1-1.9: Ensureunt(*) FROM sqlite_master WHERE name = 'temp_trig';
    } 
  } {0}
}

do_test trigger1-1.9 {
  catchsql {
    CREATE TRIGGER tr1 AFTER UPDATE ON sqlite_master BEGIN
       SELECT * FROM sqlite_master;
    END;
  }
} {1 {cannot create trigger on system table}}

# Check to make sure that a DELETE statement within the body of
# a trigger does not mess up the DELETE that caused the trigger to
# run in the first place.
#
do_test trigger1-1.10 {
  execsql {
    create table t1(a,b);
    insert into t1 values(1,'a');
    insert into t1 values(2,'b');
    insert into t1 values(3,'c');
    insert into t1 values(4,'d');
    create trigger r1 after delete on t1 for each row begin
      delete from t1 WHERE a=old.a+2;
    end;
    delete from t1 where a=1 OR a=3;
    se [concat $view_v1 {table t2}]
do_test trigger1-6.2 {
  execsql {
    CREATE TRIGGER t2 BEFORE DELETE ON t2 BEGIN
      SELECT RAISE(ABORT,'deletes are not permitted');
    END;
    SELECT type, name FROM sqlite_master;
  }
} [concat $view_v1 {table t2 trig used as trigger names.  Ticket #468
#
do_test trigger1-8.1 {
  execsql {
    CREATE TRIGGER 'trigger' AFTER INSERT ON t2 BEGIN SELECT 1; END;
    SELECT name FROM sqlite_master WHERE type='trigger';
  }
} {trigger}
do_test trigger1-8.2 {
  execsql {
    DROP TRIGGER 'trigger';
    SELECT name FROM sqlite_master WHERE type='trigger';
  }
} {}
do_test trigger1-8.3 {
  execsql {
    CREATE TRIGGER "trigger" AFTER INSERT ON t2 BEGIN SELECT 1; END;
    SELECT name FROM sqlite_master WHERE type='trigger';
  }
} {trigger}
do_test trigger1-8.4 {
  execsql {
    DROP TRIGGER "trigger";
    SELECT name FROM sqlite_master WHERE type='trigger';
  }
} {}
do_test trigger1-8.5 {
  execsql {
    CREATE TRIGGER [trigger] AFTER INSERT ON t2 BEGIN SELECT 1; END;
    SELECT name FROM sqlite_master WHERE type='trigger';
  }
} {trigger}
do_test trigger1-8.6 {
  execsql {
    DROP TRIGGER [trigger];
    SELECT name FROM sqlite_master WHERE type='trigger';
  }
} {}

ifcapable conflict {
  # Make sure REPLACE works inside of triggerrcedelete test2.db-journal
    execsql {
      ATTACH 'test2.db' AS aux;
    }
  } {}
  do_test trigger1-10.1 {
    execsql {
      CREATE TABLE main.t4(a, b, c);
      CREATE TABLE temp.t4(a, b, c);
      CREATE TABLE aux.t4(a, b, c);
      CREATE TABLE insert_log(db, a, b, c);
    }
  } {}
  do_test trigger1-10.2 {
    execsql {
      CREATE TEMP TRIGGER trig1 AFTER INSERT ON main.t4 BEGIN 
        INSERT INTO insert_log VALUES('main', new.a, new.b, new.c);
      END;
      CREATE TEMP TRIGGER trig2 AFTER INSERT ON temp.t4 BEGIN 
        INSERT INTO insert_log VALUES('temp', new.a, new.b, new.c);
      END;
      CREATE TEMP TRIGGER trig3 AFTER INSERT ON aux.t4 BEGIN 
        INSERT INTO insert_log VALUES('aux', new.a, new.b, new.c);
      END;
    }
  } {e insert_log table in a different database. Note
  # that we can change the column names because the trigger programs don't
  # use them explicitly.
    execsql {
      DROP TABLE insert_log;
      CREATE TABLE aux.insert_log(db, d, e, f);
    }
  } {}
  do_test trigger1-10.10 {
    execsql {
      INSERT INTO main.t4 VALUES(21, 22, 23);
      INSERT INTO temp.t4 VALUES(24, 25, 26);
      INSERT INTO aux.t4  VALUES(27, 28, 29);
    }
  } {}
  do_test trigger1-10.11 {
    execsql {
      SELECT * FROM insert_log;
    }
  } {main 21 22 23 temp 24 25 26 aux 27 28 29}
}

do_test trigger1-11.1 {
  catchsql {SELECT raise(abort,'message');}
} {1 {RAISE() may only be used within a trigger-program}}

do_test trigger1-15.1 {
  execsql {
    CREATE TABLE tA(a INTEGER PRIMARY KEY, b, c);
    CREATE TRIGGER tA_trigger BEFORE UPDATE ON "tA" BEGIN SELECT 1; END;
    INSERT INTO tA VALUES(1, 2, 3);
  }
  catchsql { UPDATE tA SET a = 'abc' }
} {1 {datatype mismatch}}
do_test trigger1-15.2 {
  catchsql { INSERT INTO tA VALUES('abc', 2, 3) }
} {1 {datatype mismatch}}

# Ticket #3947:  Do not allow qualified table names on INSERT, UPDATE, and
# DELETE statements within triggers.  Actually, this has never been allowed
# by the grammar.  But the error message is confusing: one simply gets a
# "syntax error".  That has now been changed to give a full error message.
#
do_test trigger1-16.1 {
  db eval {
    CREATE TABLE t16(a,b,c);
    CREATE INDEX t16a ON t16(a);
    CREATE INDEX t16b ON t16(b);
  }
  catchsql {
    CREATE TRIGGER main.t16err1 AFTER INSERT ON tA BEGIN
      INSERT INTO main.t16 VALUES(1,2,3);
    END;
  }
} {1 {qualified table names are not allowed on INSERT, UPDATE, and DELETE statements within triggers}}
do_test trigger1-16.2 {
  catchsql {
    CREATE TRIGGER main.t16err2 AFTER INSERT ON tA BEGIN
      UPDATE main.t16 SET rowid=rowid+1;
    END;
  }
} {1 {qualified table names are not allowed on INSERT, UPDATE, and DELETE statements within triggers}}
do_test trigger1-16.3 {
  catchsql {
    CREATE TRIGGER main.t16err3 AFTER INSERT ON tA BEGIN
      DELETE FROM main.t16;
    END;
  }
} {1 {qualified table names are not allowed on INSERT, UPDATE, and DELETE statements within triggers}}
do_test trigger1-16.4 {
  catchsql {
    CREATE TRIGGER main.t16err4 AFTER INSERT ON tA BEGIN
      UPDATE t16 NOT INDEXED SET rowid=rowid+1;
    END;
  }
} {1 {the NOT INDEXED clause is not allowed on UPDATE or DELETE statements within triggers}}
do_test trigger1-16.5 {
  catchsql {
    CREATE TRIGGER main.t16err5 AFTER INSERT ON tA BEGIN
      UPDATE t16 INDEXED BY t16a SET rowid=rowid+1 WHERE a=1;
    END;
  }
} {1 {the INDEXED BY clause is not allowed on UPDATE or DELETE statements within triggers}}
do_test trigger1-16.6 {
  catchsql {
    CREATE TRIGGER main.t16err6 AFTER INSERT ON tA BEGIN
      DELETE FROM t16 NOT INDEXED WHERE a=123;
    END;
  }
} {1 {the NOT INDEXED clause is not allowed on UPDATE or DELETE statements within triggers}}
do_test trigger1-16.7 {
  catchsql {
    CREATE TRIGGER main.t16err7 AFTER INSERT ON tA BEGIN
      DELETE FROM t16 INDEXED BY t16a WHERE a=123;
    END;
  }
} {1 {the INDEXED BY clause is not allowed on UPDATE or DELETE statements within triggers}}

#-------------------------------------------------------------------------
# Test that bug [34cd55d68e0e6e7c] has been fixed.
#
do_execsql_test trigger1-17.0 {
  CREATE TABLE t17a(ii INT);
  CREATE TABLE t17b(tt TEXT PRIMARY KEY, ss);
  CREATE TRIGGER t17a_ai AFTER INSERT ON t17a BEGIN
    INSERT INTO t17b(tt) VALUES(new.ii);
  END;
  CREATE TRIGGER t17b_ai AFTER INSERT ON t17b BEGIN
    UPDATE t17b SET ss = 4;
  END;
  INSERT INTO t17a(ii) VALUES('1');
  PRAGMA integrity_check;
} {ok}

# 2018-04-26
# When a BEFORE UPDATE trigger changes a column value in a row being
# updated, and that column value is used by the UPDATE to change other
# column, the value used to compute the update is from before the trigger.
# In the example that follows, the value of "b" in "c=b" is 2 (the value
# prior to running the BEFORE UPDATE trigger) not 1000.
#
do_execsql_test trigger1-18.0 {
  CREATE TABLE t18(a PRIMARY KEY,b,c);
  INSERT INTO t18(a,b,c) VALUES(1,2,3);
  CREATE TRIGGER t18r1 BEFORE UPDATE ON t18 BEGIN
    UPDATE t18 SET b=1000 WHERE a=old.a;
  END;
  UPDATE t18 SET c=b WHERE a=1;
  SELECT * FROM t18;
} {1 1000 2}  ;# Not: 1 1000 1000 
do_execsql_test trigger1-18.1 {
  DELETE FROM t18;
  INSERT INTO t18(a,b,c) VALUES(1,2,3);
  UPDATE t18 SET c=b, b=b+1 WHERE a=1;
  SELECT * FROM t18;
} {1 3 2}     ;# Not: 1 1001 1000

# 2018-04-26 ticket [https://www.sqlite.org/src/tktview/d85fffd6ffe856092e]
# VDBE Program uses an expired value.
#
do_execsql_test trigger1-19.0 {
  CREATE TABLE t19(a INT PRIMARY KEY, b, c)WITHOUT ROWID;
  INSERT INTO t19(a,b,c) VALUES(1,2,3);
  CREATE TRIGGER t19r3 BEFORE UPDATE ON t19 BEGIN SELECT new.b; END;
  UPDATE t19 SET c=b WHERE a=1;
  SELECT * FROM t19;
} {1 2 2}
do_execsql_test trigger1-19.1 {
  DELETE FROM t19;
  INSERT INTO t19(a,b,c) VALUES(1,2,3);
  UPDATE t19 SET c=CASE WHEN b=2 THEN b ELSE b+99 END WHERE a=1;
  SELECT * FROM t19;
} {1 2 2}

# 2019-08-26 Chromium sqlite3_fts3_lpm_fuzzer find.
#
db close
sqlite3 db :memory:
do_execsql_test trigger1-20.1 {
  CREATE TABLE t20_1(x);
  ATTACH ':memory:' AS aux;
  CREATE TABLE aux.t20_2(y);
  CREATE TABLE aux.t20_3(z);
  CREATE TEMP TRIGGER r20_3 AFTER INSERT ON t20_2 BEGIN UPDATE t20_3 SET z=z+1; END;
  DETACH aux;
  DROP TRIGGER r20_3;
} {}

# 2019-10-24 ticket 50c09fc2cf0d91ce
#
db close
sqlite3 db :memory:
do_execsql_test trigger1-21.1 {
  PRAGMA recursive_triggers = true;
  CREATE TABLE t0(a, b, c UNIQUE);
  CREATE UNIQUE INDEX i0 ON t0(b) WHERE a;
  CREATE TRIGGER tr0 AFTER DELETE ON t0 BEGIN
    DELETE FROM t0;
  END;
  INSERT INTO t0(a,b,c) VALUES(0,0,9),(1,1,1);
  REPLACE INTO t0(a,b,c) VALUES(2,0,9);
  SELECT * FROM t0;
} {2 0 9}

# 2020-01-04 From Yongheng
# The test case below caused problems for the register validity
# tracking logic.  There was no bug in the release build.  The
# only problem was a false-positive in the register validity
# tracking.
#
reset_db
do_execsql_test trigger1-22.10 {
  CREATE TABLE t1(
    a INTEGER PRIMARY KEY,
    b DOUBLE
  );
  CREATE TRIGGER x AFTER UPDATE ON t1 BEGIN
   SELECT sum(b)OVER(ORDER BY (SELECT b FROM t1 AS x 
                               WHERE b IN (t1.a,127,t1.b)
                               GROUP BY b))
     FROM t1
     GROUP BY a;
  END;
  CREATE TEMP TRIGGER x BEFORE INSERT ON t1 BEGIN
    UPDATE t1
       SET b=randomblob(10)
     WHERE b >= 'E'
       AND a < (SELECT a FROM t1 WHERE a<22 GROUP BY b);
  END;
  INSERT INTO t1(b) VALUES('Y'),('X'),('Z');
  SELECT a, CASE WHEN typeof(b)='text' THEN quote(b) ELSE '<blob>' END, '|' FROM t1;
} {1 <blob> | 2 'X' | 3 'Z' |}

finish_test
